id,user_id,category,title,description,year,proof_type,proof_value,status,created_at
7ee4c464-7ee6-4d6c-b728-d73ea5592c34,bf7e68d1-6c92-47ee-abb9-b8c71150a7df,creative,"Участник международного конкурса аниматоров","Анимационный ролик прошёл в финальный тур международного студенческого конкурса аниматоров.",2025,photo,"https://example.com/photos/gdt56zkd.jpg",verified,2026-02-25 03:48:06
fd3f50a4-19f3-416f-86ed-fe77ed72c80f,0138ebef-ee40-4f1c-8694-54fae360ec35,sport,"Мастер спорта по плаванию","Выполнил норматив мастера спорта на чемпионате региона. Личный рекорд — 200м вольным стилем за 1:52.",2024,link,"https://example.com/proof/1ulod6hw",verified,2026-02-02 06:26:31
94ee5039-7755-4743-8da6-a76602d5e1b4,845896cb-5254-48d6-a168-3644fe7eeb4c,sport,"Чемпион университета по футболу","Сборная заняла первое место в чемпионате студенческой лиги. Забил решающий гол в финале.",2025,photo,"https://example.com/photos/mgvnasmw.jpg",verified,2025-11-11 13:31:01
408489c1-25f1-47ad-9d96-698ff0674a13,8f9d23b0-49f1-405f-9991-5fb83dad81fc,sport,"Призёр регионального чемпионата по боксу","Занял второе место на чемпионате области в весовой категории до 75 кг. Провёл 5 боёв без поражений.",2023,photo,"https://example.com/photos/2x3mrreg.jpg",verified,2026-03-06 01:09:20
3a54a482-28a7-4f38-9692-fcd860d3609c,3d1fc270-44bb-4778-9240-32ed85670a22,sport,"Выполнил KMS по лёгкой атлетике","Выполнил норматив кандидата в мастера спорта в беге на 1500м. Результат — 3:48.2.",2022,none,NULL,verified,2026-01-17 05:49:41
36001b39-061d-4183-b10c-39892d7d2a3a,e8333701-ba13-454c-bc06-312c9c330495,sport,"Участник международных соревнований по шахматам","Участвовал в международном шахматном турнире, набрал 7/9 очков и выполнил норму FIDE-мастера.",2022,photo,"https://example.com/photos/dtcli1ud.jpg",verified,2026-02-07 05:30:02
18264a55-5083-40fe-805e-e194d2ae157f,2630cfe2-bb0b-4c34-bcab-5cbcee34b476,sport,"Победитель городских соревнований по бадминтону","Занял первое место в одиночном разряде на городских соревнованиях по бадминтону среди взрослых.",2022,none,NULL,verified,2025-12-06 13:22:33
20a5235e-5830-4f31-bd9a-a1106f2c0db5,e8333701-ba13-454c-bc06-312c9c330495,sport,"Призёр чемпионата по настольному теннису","Занял третье место на открытом чемпионате региона. Выиграл в 8 партиях из 10.",2022,link,"https://example.com/proof/2o5zmwu1",verified,2025-11-20 17:50:40
87b0d168-ea0f-458b-9fa2-5b7676d3542d,8f9d23b0-49f1-405f-9991-5fb83dad81fc,sport,"Серебряный призёр по скалолазанию","Занял второе место на чемпионате по скалолазанию в дисциплине "Трудность" среди юниоров.",2025,photo,"https://example.com/photos/rinr9mj0.jpg",verified,2026-04-24 17:31:22
999ffdf2-9e08-4a22-b324-b7884a206205,db7e2101-b84a-4240-b5b4-f199cdc672d6,sport,"Финишировал полумарафон за 1:42","Пробежал первый полумарафон за 1 час 42 минуты. Подготовка заняла 4 месяца интенсивных тренировок.",2022,photo,"https://example.com/photos/7ec51n68.jpg",verified,2026-02-06 15:57:27
e37c5cac-97bb-4ca8-887c-25b71fa1896a,43ca9abd-4d63-430a-bd85-c38aec4cf261,sport,"Победитель турнира по киберспорту Dota 2","Команда заняла первое место на региональном LAN-турнире по Dota 2. Призовой фонд — 50 000 руб.",2023,none,NULL,verified,2026-04-22 07:47:19
02ec2d02-54ca-419b-a961-e343ef1d737a,e01fac7d-a9a5-48e5-88be-d0a6a7c3de84,sport,"Выполнил 1 взрослый разряд по карате","Выполнил норматив первого взрослого разряда по карате. Сдал экзамен и выступил на официальных соревнованиях.",2022,photo,"https://example.com/photos/iymdglo8.jpg",verified,2025-11-12 09:44:01
168d1efe-ec1b-4be0-a749-80f8acef5955,30b248ba-8471-4ab4-95ee-c4b831a8f27a,sport,"Призёр региональных соревнований по велоспорту","Занял третье место в гонке с раздельным стартом на дистанции 40 км. Средняя скорость — 38 км/ч.",2025,none,NULL,verified,2026-01-14 17:42:44
4154f4ed-ebbf-4549-8451-19b44edf023b,bf7e68d1-6c92-47ee-abb9-b8c71150a7df,sport,"Участник марафона "Белые ночи"","Финишировал в марафоне "Белые ночи" за 3 часа 24 минуты. Личный рекорд на дистанции 42,2 км.",2024,none,NULL,verified,2026-04-15 23:40:34
4aa8178f-9942-4977-9932-7d66d0022aa7,2f4a3081-fcd4-43f5-9fc4-1576aedbd6c5,sport,"Чемпион школы по волейболу","Команда выиграла школьный чемпионат по волейболу. Личный вклад — 12 подач-эйсов в финале.",2022,link,"https://example.com/proof/wiia7q5y",verified,2026-03-12 00:29:56
db26b423-62b2-4f48-9ce3-3f1e66948cad,f1112344-3c2d-45f8-a600-bdf9d6c92c19,sport,"Призёр соревнований по спортивной гимнастике","Занял второе место на соревнованиях по спортивной гимнастике в упражнениях на кольцах.",2025,photo,"https://example.com/photos/f2afc6lu.jpg",verified,2025-12-10 00:15:14
3375aac3-114c-4d73-b7ca-a9338c23b700,0138ebef-ee40-4f1c-8694-54fae360ec35,sport,"Выполнил норматив по лыжным гонкам","Выполнил норматив первого разряда по лыжным гонкам. Дистанция 30 км за 1:24:30.",2023,photo,"https://example.com/photos/2o1twqt2.jpg",verified,2026-01-30 08:42:47
3e7eaeb6-c0b5-4af0-8ccf-71d60462a300,40532321-f9a6-4337-96a0-f4fa828d83ce,sport,"Победитель турнира по шахматам Рапид","Занял первое место на городском шахматном турнире в формате Рапид (15 минут + 10 секунд).",2025,none,NULL,verified,2026-01-19 16:33:22
04784d02-a42d-4354-84ad-9400dbc15e60,cdefde42-3fee-46ac-950f-db94b5939acb,sport,"Призёр чемпионата по армрестлингу","Занял второе место на открытом чемпионате района по армрестлингу в весе до 80 кг.",2023,link,"https://example.com/proof/sagifvoc",verified,2026-01-10 20:47:27
b4d7b70b-4831-4f30-9169-fc79a7271dca,f49dc8e9-87a6-4171-ac79-5e2b70db6b85,sport,"Участник лиги по баскетболу 3×3","Команда вышла в полуфинал городской лиги по баскетболу 3×3. Набрал 15 очков в решающей игре.",2023,none,NULL,verified,2026-02-27 11:06:27
1ba362eb-83df-44e6-8864-39b26c1e5c70,bf7e68d1-6c92-47ee-abb9-b8c71150a7df,sport,"Выполнил норматив по плаванию на открытой воде","Финишировал в заплыве на 5 км по открытой воде. Занял пятое место среди 80 участников.",2022,none,NULL,verified,2025-12-21 06:06:16
90c18cd1-f003-4fb0-a8e7-a8d2fdce936f,43ca9abd-4d63-430a-bd85-c38aec4cf261,sport,"Чемпион университета по бегу","Выиграл университетский кросс на 10 км. Опередил соперников на финише с преимуществом 15 секунд.",2025,none,NULL,verified,2026-04-20 16:56:28
18a538f6-1b68-4f11-a05e-7ba78bfedaba,845896cb-5254-48d6-a168-3644fe7eeb4c,sport,"Призёр по борьбе самбо","Занял третье место на региональных соревнованиях по самбо в весовой категории до 68 кг.",2022,none,NULL,verified,2026-05-08 05:28:28
f413a2c1-dadd-4d6a-b657-28d52d158766,0886fe23-3a95-4f92-bc63-fe30c282d010,sport,"Финишировал триатлон Sprint","Завершил спринт-триатлон (750м+20км+5км) за 1 час 12 минут. Первый старт в триатлоне.",2024,photo,"https://example.com/photos/fl5xcz0o.jpg",verified,2025-12-16 17:08:51
399dd1c2-5599-4455-a9b0-ee24dde163aa,9f371917-c270-43c7-a426-195c07f2240e,sport,"Победитель турнира по теннису","Выиграл городской любительский турнир по теннису. Не проиграл ни одного сета в турнире.",2025,link,"https://example.com/proof/3975rtno",verified,2025-12-14 10:17:03
4dc5bfff-f1ab-4765-9dc1-ceb26cf92912,502540e8-ad44-4ede-bede-dc9be40684b9,sport,"Призёр соревнований по плаванию в ластах","Занял второе место на чемпионате региона по плаванию в ластах на дистанции 100м.",2025,link,"https://example.com/proof/ebn1rc98",verified,2026-01-29 09:52:13
e99b65a3-81b8-41be-9180-14984eb596cb,9f371917-c270-43c7-a426-195c07f2240e,sport,"Выполнил норматив по гребле","Выполнил норматив второго разряда по академической гребле. Занял четвёртое место на регате.",2025,none,NULL,verified,2025-12-29 21:59:40
305e7f80-574e-40fa-aaba-6a312837cc01,a99a1319-a218-498b-8451-7fb3dc12ade1,sport,"Чемпион по настольным шахматам на ФестивалеМоей школы","Стал чемпионом среди 300 участников школьного шахматного фестиваля.",2023,link,"https://example.com/proof/288jixbv",verified,2026-03-04 21:07:54
57887d06-b553-430e-8224-58e294600678,0886fe23-3a95-4f92-bc63-fe30c282d010,sport,"Призёр соревнований по ориентированию","Занял второе место на соревнованиях по спортивному ориентированию в зачёте "средняя дистанция".",2025,none,NULL,verified,2026-04-11 04:14:49
a940c349-c158-4009-9eb7-b52790109a6b,9ff7aa17-cdef-4ae4-8854-165791ca0eb4,sport,"Завершил велопробег 1000 км","Завершил самостоятельный велопробег Москва — Санкт-Петербург за 4 дня. Преодолено 1 050 км.",2022,photo,"https://example.com/photos/2x1tqxoj.jpg",verified,2026-04-15 00:28:51
3abf67be-ee70-481a-b593-3c43ae2a53f4,502540e8-ad44-4ede-bede-dc9be40684b9,sport,"Победитель хакатона по виртуальному спорту","Команда разработала систему трекинга движений для виртуального спорта и заняла первое место.",2024,link,"https://example.com/proof/8fsyi1im",verified,2026-05-05 08:54:39
f355c22b-c861-4f8d-a02f-f5b5ec14ac87,b4eb03a1-f303-40f0-9099-c2b013035e46,sport,"Призёр соревнований по биатлону","Занял третье место на региональных соревнованиях по биатлону в возрастной группе 20–25 лет.",2022,photo,"https://example.com/photos/vvfzwgvc.jpg",verified,2026-01-13 17:40:31
dc9e1393-e9bf-4ad8-aae1-119a7a412af9,43ca9abd-4d63-430a-bd85-c38aec4cf261,sport,"Завершил Ironman 70.3","Финишировал в полужелезном триатлоне за 5 часов 38 минут. Личный рекорд на всех трёх этапах.",2025,photo,"https://example.com/photos/ybq7lkp2.jpg",verified,2026-01-01 09:08:25
da767943-eec2-44b4-85ea-167a2e579301,55a067ca-8de7-4731-ab91-9f79fc176598,sport,"Победитель городского кросса","Финишировал первым в городском кроссе на 8 км. Опередил второго участника на 23 секунды.",2022,link,"https://example.com/proof/76scem9n",verified,2026-04-13 14:11:41
1a5cfcf4-4ac3-4866-a2a2-0dc385e4cadd,f1112344-3c2d-45f8-a600-bdf9d6c92c19,movies,"Победитель викторины по кино на CinemaFest","Занял первое место в киновикторине на городском кинофестивале. Ответил на 48 из 50 вопросов правильно.",2025,photo,"https://example.com/photos/uv42upj8.jpg",verified,2026-04-23 13:14:02
a1f2f13c-98c4-40bc-9e34-f85a17b47e80,43ca9abd-4d63-430a-bd85-c38aec4cf261,movies,"Рецензия опубликована на KinoPoisk","Рецензия на фильм "Дюна: Часть вторая" набрала более 500 лайков и попала в редакционную подборку.",2022,photo,"https://example.com/photos/sow7uxgr.jpg",verified,2026-01-19 19:01:51
c0cc701c-6b7d-4b44-adcd-5f3e975767ce,2630cfe2-bb0b-4c34-bcab-5cbcee34b476,movies,"Ведущий киноклуба в университете","Организовал и вёл университетский киноклуб в течение года. Проведено 24 показа, 300+ участников.",2024,none,NULL,verified,2025-12-07 21:51:13
121e4467-46c6-4837-b68f-ff5466cd309b,9f371917-c270-43c7-a426-195c07f2240e,movies,"Призёр конкурса кинокритики","Эссе о режиссёрском методе Андрея Тарковского заняло второе место на конкурсе молодых кинокритиков.",2023,link,"https://example.com/proof/5cic5tcr",verified,2026-04-17 12:32:26
f207dc53-1903-45b4-a5b5-55e4e2c9b306,1cea6d45-e946-4598-95e0-2af5eda225fa,movies,"Посмотрел все фильмы из списка IMDb Top 250","Завершил просмотр всех 250 фильмов из рейтинга IMDb. Вёл подробный дневник впечатлений.",2022,none,NULL,verified,2026-02-18 19:06:02
44243e17-f981-4fe0-8196-2565e33f5eec,f1112344-3c2d-45f8-a600-bdf9d6c92c19,movies,"Участник жюри студенческого кинофестиваля","Вошёл в состав студенческого жюри регионального кинофестиваля и оценил 45 короткометражек.",2025,photo,"https://example.com/photos/g3dkrjjh.jpg",verified,2026-03-31 18:56:19
334e0531-4a75-4011-a85f-178462a64141,2630cfe2-bb0b-4c34-bcab-5cbcee34b476,movies,"Написал сценарий короткометражного фильма","Сценарий "Пустой стакан" был отобран для экранизации в рамках учебного кинопроекта.",2022,none,NULL,verified,2026-03-10 04:27:02
fd95cf7d-a38b-4f53-b13d-10f214e76866,55a067ca-8de7-4731-ab91-9f79fc176598,movies,"Победитель квиза "Угадай фильм по кадру"","Выиграл онлайн-квиз по определению фильмов по одному стоп-кадру. 47/50 правильных ответов.",2025,photo,"https://example.com/photos/ucos78k6.jpg",verified,2026-02-08 14:30:44
94c62575-1104-48aa-91df-1e214322361a,11323a38-9782-472c-81d9-e55808938089,movies,"Опубликовал разбор кинематографа Нолана","Статья-разбор нелинейного нарратива в фильмах Кристофера Нолана получила 2000+ просмотров на Habr.",2025,none,NULL,verified,2026-01-26 17:06:25
3d78ccc8-f246-4bae-88aa-2c1027ed2c29,f470eeec-90f3-4d9e-a649-e30cc7235307,movies,"Призёр олимпиады по медиаграмотности","Занял второе место на олимпиаде по медиаграмотности в блоке "Анализ кинотекста".",2023,photo,"https://example.com/photos/et1c4cbk.jpg",verified,2026-04-28 22:51:23
3280fa8f-2916-4e55-ab1c-cfad20028e97,4614728e-6dde-4d7d-94db-4fbfba14dbfc,movies,"Автор подкаста о кино с 500+ слушателями","Веду еженедельный подкаст о мировом кино. За год вышло 40 эпизодов, аудитория — 500+ слушателей.",2023,photo,"https://example.com/photos/zj6ow4j6.jpg",verified,2026-01-21 22:50:23
a280e09a-3a10-41df-80a2-5824ad8de9f8,bf7e68d1-6c92-47ee-abb9-b8c71150a7df,movies,"Прошёл курс "Язык кино" в Кинопоиске","Завершил образовательный курс по теории кино на платформе Кинопоиска. Все тесты сданы на отлично.",2025,photo,"https://example.com/photos/4k946gku.jpg",verified,2025-11-22 21:37:26
17955f18-ec03-4d2c-a9e1-1a6bf38fd235,43ca9abd-4d63-430a-bd85-c38aec4cf261,movies,"Победитель конкурса синопсисов","Синопсис криминальной драмы "Серый туман" занял первое место в конкурсе для начинающих сценаристов.",2022,link,"https://example.com/proof/rhvttxk5",verified,2025-11-23 08:57:54
0a28576c-fea1-46d7-abcc-1b75eb188824,09880585-9642-49d6-acbc-a9756cefba27,movies,"Посетил 5 международных кинофестивалей","Посетил фестивали в Москве, Санкт-Петербурге и Казани. Посмотрел более 80 премьерных показов.",2024,none,NULL,verified,2026-01-16 18:19:15
33b1bc79-e70a-4ad0-9bed-d4b7c1ce77b4,ac4f1fc1-df74-483c-b55b-0c3539830356,movies,"Призёр конкурса кинофотографии","Серия работ в стиле cine still фотографии заняла второе место в тематическом конкурсе.",2023,photo,"https://example.com/photos/o855ppx8.jpg",verified,2025-12-28 08:18:59
a76362a6-65ef-4651-9497-ce4a4cc612a6,f1112344-3c2d-45f8-a600-bdf9d6c92c19,movies,"Победитель теста на знание советского кино","Набрал 100% на тесте о советском кинематографе. Участвовал в цикле вечеров о классике кино.",2025,none,NULL,verified,2025-12-03 15:34:30
6da00608-6611-4588-9fb2-e4a2b72a6494,665206c4-30d9-4794-8904-f4515483466b,movies,"Написал эссе о кино в научный сборник","Статья о постколониальном нарративе в корейском кино опубликована в студенческом научном сборнике.",2023,none,NULL,verified,2026-04-01 22:47:02
bba859dc-54e5-46cd-bff3-c0aea07fd94c,8f9d23b0-49f1-405f-9991-5fb83dad81fc,movies,"Участник мастер-класса режиссёра","Прошёл двухдневный мастер-класс известного документалиста. Снял учебный репортаж.",2022,photo,"https://example.com/photos/cfcguaw1.jpg",verified,2025-11-12 03:52:50
33d8d864-e227-475c-848f-565f2fffafe0,6eac0341-252c-46dc-9555-9b8d21bd106e,movies,"Призёр конкурса трейлеров","Смонтированный авторский трейлер к книге занял третье место в конкурсе книжных видеороликов.",2024,none,NULL,verified,2026-01-29 16:23:50
dbfd7d82-7f4f-4c2b-8424-27e4e87c4f9f,f49dc8e9-87a6-4171-ac79-5e2b70db6b85,movies,"Победитель киновикторины на ТВ-шоу","Поучаствовал в телевизионном шоу-викторине о кино и занял первое место в выпуске.",2025,link,"https://example.com/proof/q8xv0q8i",verified,2026-01-07 05:12:15
f71367f0-559e-4483-8474-23192904db05,e479547f-65fe-49c2-8c60-2ad85984123b,movies,"Написал рецензию в печатный журнал","Рецензия на ретроспективу фестивального кино опубликована в региональном культурном журнале.",2023,none,NULL,verified,2026-05-03 09:54:36
33122c2c-6348-49dc-96ea-50254951ba78,3d1fc270-44bb-4778-9240-32ed85670a22,movies,"Призёр конкурса стримеров кино","Завоевал второе место в конкурсе кинострим-комментаторов. Стрим собрал 800 одновременных зрителей.",2025,photo,"https://example.com/photos/cxtzso5f.jpg",verified,2025-12-13 07:31:38
b1216282-7445-4de4-b4af-6e01adfe7cb3,6eac0341-252c-46dc-9555-9b8d21bd106e,movies,"Победитель киноквиза среди университетов","Команда из 4 человек заняла первое место в межвузовском киноквизе.",2022,link,"https://example.com/proof/8dhwdrhw",verified,2026-03-09 11:34:56
24281349-276d-4cb8-9832-e989b1d7da0e,845896cb-5254-48d6-a168-3644fe7eeb4c,games,"Достиг Challenger в League of Legends","Достиг звания Challenger в сезоне 2024. Вошёл в топ-300 игроков сервера.",2025,photo,"https://example.com/photos/oiqvodvf.jpg",verified,2025-12-30 05:10:42
f084ce55-ce46-476f-9ec0-46acafd9df57,9f371917-c270-43c7-a426-195c07f2240e,games,"Победитель регионального турнира по CS2","Команда заняла первое место на региональном любительском турнире по Counter-Strike 2.",2023,photo,"https://example.com/photos/6ez1jecn.jpg",verified,2026-04-20 06:00:51
bf1d38a1-de4e-4482-9057-73fcd0c30051,25a736a7-a435-4138-bd1d-50f47492ee31,games,"Завершил все достижения в The Witcher 3","Получил все 78 достижений в The Witcher 3: Wild Hunt включая дополнения. 250+ часов в игре.",2024,none,NULL,verified,2026-03-29 17:16:12
755d5a48-9ef5-468b-8cfd-a5a719d2dc67,3d1fc270-44bb-4778-9240-32ed85670a22,games,"Участник финала RuHub Dota 2","Команда вышла в финал любительского турнира RuHub и заняла второе место из 128 команд.",2023,none,NULL,verified,2026-04-06 02:19:04
663bb4ec-ecb5-43ba-bbbd-549a4827fe56,bf7e68d1-6c92-47ee-abb9-b8c71150a7df,games,"Призёр турнира по Hearthstone","Занял третье место в онлайн-турнире по Hearthstone. Собрал уникальную комбо-колоду.",2025,none,NULL,verified,2026-03-18 05:39:00
1f6dba28-2e21-4be9-b48d-c9ceecdbe520,9f371917-c270-43c7-a426-195c07f2240e,games,"Достиг Mythic+ в World of Warcraft","Завершил ключ Mythic+20 и попал в топ-1000 игроков рейда в своём регионе.",2023,link,"https://example.com/proof/mq1glqfn",verified,2026-04-01 14:11:42
29b10459-34da-44b1-a3a5-ee8f6db022d3,0886fe23-3a95-4f92-bc63-fe30c282d010,games,"Победитель университетского турнира по FIFA","Выиграл университетский чемпионат по FIFA 25. Прошёл через 32 участника без единого поражения.",2025,none,NULL,verified,2026-02-26 08:55:12
7c02bde3-76c8-4278-a9ab-03ead191b768,db7e2101-b84a-4240-b5b4-f199cdc672d6,games,"Прошёл Elden Ring без смертей","Завершил полное прохождение Elden Ring без смертей (No Death Run). Запись опубликована на YouTube.",2023,none,NULL,verified,2026-04-07 03:44:59
d5a2400f-3e69-4839-8fa8-7c5891fb8613,b4eb03a1-f303-40f0-9099-c2b013035e46,games,"Призёр онлайн-чемпионата по Rocket League","Достиг ранга Grand Champion и занял второе место в региональном онлайн-чемпионате.",2024,link,"https://example.com/proof/aivlyayj",verified,2025-12-21 17:59:59
088ce6d5-d3f0-4648-ab69-39d5708b7314,a99a1319-a218-498b-8451-7fb3dc12ade1,games,"Создал мод для Skyrim с 50 000 загрузок","Разработал и опубликовал мод на Nexus Mods. За месяц набрал более 50 000 загрузок.",2024,photo,"https://example.com/photos/anq0pvzx.jpg",verified,2026-03-08 14:06:23
9ddd1632-e817-4559-be8d-22d1282363d3,1cea6d45-e946-4598-95e0-2af5eda225fa,games,"Победитель турнира по шахматам Chess.com","Выиграл открытый онлайн-турнир на Chess.com с рейтингом 2200+. 64 участника.",2024,photo,"https://example.com/photos/1tfwb699.jpg",verified,2026-01-08 05:55:40
9e45784f-ed5d-4a76-9811-a91c486a8e4e,c86b36d4-ceb2-43a5-87ed-94f9cf57aa47,games,"Достиг 100% в Hollow Knight","Выполнил 100% прохождение Hollow Knight включая все испытания пантеонов. 65 часов.",2024,none,NULL,verified,2026-02-27 12:09:38
